{
  "schema_version": 2,
  "manifest_state": "review_required",
  "repositories": {
    "upstream": {
      "url": "https://github.com/NousResearch/hermes-agent.git"
    },
    "fork": {
      "url": "https://github.com/royalaid/hermes-agent.git"
    }
  },
  "integration": {
    "repository": "fork",
    "ref": "refs/heads/fork-integration",
    "upstream_repository": "upstream",
    "upstream_ref": "refs/heads/main",
    "expected_base_commit": "e5bc6b21868efad57414b1d28abbbb5ce26765c9",
    "expected_head_commit": null
  },
  "required_categories": [
    "updater"
  ],
  "required_patch_ids": [
    "c8b43d1da72f518463132b4665b2da45c54ea612",
    "6a3f83308b6267066261c809df9721a2909c2b53",
    "364d4a976831227d6d3732f3b6f159425e921cb4",
    "b998a4ce1bc857abd3c5cad0137055d543493216",
    "848e8bdbaa6f555a9a2474bbea85d0152d5f8791",
    "a6a828c29d5a792d5809b68554b763e67b2ad3ee",
    "cd436cf6d70095daebbeae217bb2717514d1fe15",
    "330f2003790b0b7e922eae882c52d2226c2c30ce",
    "7d1058747ec25f42f784d7cad44e00baee2e62ff",
    "c271c1fa18d7ff37b6c03c19a903ee688e3237da",
    "c612111f63bc0c0eb6e003a56f2bfae4f574daf9",
    "11a4f4cd7f621e1217f17672cb90cc482d9fb6ca",
    "94032a920e6ede8dabe2d9b6646d5802fa73c932",
    "d79c677c75d4c3515371e84f3f6818944f46c963",
    "92da96924c9668c77b77011cc5403090c1a4cf82",
    "d4134d0928f41504394aebdb6bc4e5cb4dca50f5",
    "3fcef96a39916cb7d1f5ec1ba8740ba721d075d3",
    "ce99e4b056fc824d773e637e56845cff19b3ba8b",
    "28b927d6e9a09e78fffed15c7480b658be5d478a",
    "478f889b8f7cd5cb723f8e9afa788ac883d44e13",
    "f86cff4f611c5b5f016260557cdabb57f75180e0",
    "24e72bb4f36d99211d8adeed737bc79564da9c71",
    "0d1a3112d4228bbdf0421ba97a29f074e9d2f130",
    "36eea134ff23b4cc3414d98efa6a4ed97e1767a0",
    "7e226e7568e9f8cda10123d6ba331c19abcc360e"
  ],
  "components": [
    {
      "id": "windows-host-path",
      "category": "desktop",
      "upstream_status": "review_required",
      "intended_upstream_status": "required",
      "source": {
        "repository": "fork",
        "ref": null,
        "legacy_ref": "205e59a813586e1e5bb644b11ce9b1b410b09867"
      },
      "tests": [
        "apps/desktop/electron/backend-command.test.ts"
      ],
      "review_notes": "Required fork behavior retained; restore the immutable source object and portable source ref before release.",
      "patches": [
        {
          "subject": "fix(desktop): preserve live Windows host PATH",
          "role": "implementation",
          "disposition": "required",
          "source": {
            "commit": "205e59a813586e1e5bb644b11ce9b1b410b09867",
            "stable_patch_id": "c8b43d1da72f518463132b4665b2da45c54ea612"
          },
          "integration": {
            "state": "pending",
            "commit": null,
            "stable_patch_id": null
          }
        }
      ]
    },
    {
      "id": "reasoning-item-boundaries",
      "category": "model-protocol",
      "upstream_status": "review_required",
      "intended_upstream_status": "required",
      "source": {
        "repository": "fork",
        "ref": null,
        "legacy_ref": "fork/fix/installed-reasoning-summary-rows"
      },
      "tests": [
        "apps/desktop/src/lib/reasoning-blocks.test.ts",
        "tests/agent/test_reasoning_summaries.py"
      ],
      "review_notes": "Required fork behavior retained; legacy source commits are absent from this object database.",
      "patches": [
        {
          "subject": "fix(codex): preserve reasoning item boundaries",
          "role": "implementation",
          "disposition": "required",
          "source": {
            "commit": "eb723f2faa79e749ba7e05d81f1a08e664819634",
            "stable_patch_id": "6a3f83308b6267066261c809df9721a2909c2b53"
          },
          "integration": { "state": "pending", "commit": null, "stable_patch_id": null }
        },
        {
          "subject": "test(desktop): isolate reasoning item layout",
          "role": "test",
          "disposition": "required",
          "related_to": "eb723f2faa79e749ba7e05d81f1a08e664819634",
          "source": {
            "commit": "891b596006f1fc1101e079f4ea73fb01ddbe1015",
            "stable_patch_id": "364d4a976831227d6d3732f3b6f159425e921cb4"
          },
          "integration": { "state": "pending", "commit": null, "stable_patch_id": null }
        },
        {
          "subject": "[verified] fix(desktop): preserve native reasoning summaries",
          "role": "implementation",
          "disposition": "required",
          "related_to": "eb723f2faa79e749ba7e05d81f1a08e664819634",
          "source": {
            "commit": "51962fc0fb0dc468b5c8ab66c43d9a6a0e3dce3a",
            "stable_patch_id": "b998a4ce1bc857abd3c5cad0137055d543493216"
          },
          "integration": { "state": "pending", "commit": null, "stable_patch_id": null }
        },
        {
          "subject": "fix(codex): preserve streamed reasoning summary rows",
          "role": "implementation",
          "disposition": "required",
          "related_to": "eb723f2faa79e749ba7e05d81f1a08e664819634",
          "source": {
            "commit": "41f4621abec31afb7c82923a72a9f88a2075ea4b",
            "stable_patch_id": "848e8bdbaa6f555a9a2474bbea85d0152d5f8791"
          },
          "integration": { "state": "pending", "commit": null, "stable_patch_id": null }
        }
      ]
    },
    {
      "id": "desktop-hitch-diagnostics",
      "category": "diagnostics",
      "upstream_status": "review_required",
      "intended_upstream_status": "required",
      "source": {
        "repository": "fork",
        "ref": null,
        "legacy_ref": "fork/feat/desktop-hitch-diagnostics"
      },
      "tests": [
        "apps/desktop/electron/renderer-diagnostics.test.ts",
        "tests/hermes_cli/test_diagnostics_upload.py"
      ],
      "review_notes": "Required fork diagnostics retained; immutable source objects and final replay identities require review.",
      "patches": [
        {
          "subject": "docs: plan for desktop hitching diagnostics and confirmed local fixes",
          "role": "documentation",
          "disposition": "required",
          "source": { "commit": "94454bf542b7a673423dd59d9139e9db16848e2e", "stable_patch_id": "a6a828c29d5a792d5809b68554b763e67b2ad3ee" },
          "integration": { "state": "pending", "commit": null, "stable_patch_id": null }
        },
        {
          "subject": "feat(desktop): renderer diagnostics capture module (U2)",
          "role": "implementation",
          "disposition": "required",
          "source": { "commit": "4ff79eaa89dc1eba0565b937a9c3b707db7bc094", "stable_patch_id": "cd436cf6d70095daebbeae217bb2717514d1fe15" },
          "integration": { "state": "pending", "commit": null, "stable_patch_id": null }
        },
        {
          "subject": "fix(kanban): stop delegated-child permission-error reconnect storm (U1)",
          "role": "implementation",
          "disposition": "required",
          "related_to": "4ff79eaa89dc1eba0565b937a9c3b707db7bc094",
          "source": { "commit": "f22b305b8065c2243dbd9ffccbdc59f89c281b1d", "stable_patch_id": "330f2003790b0b7e922eae882c52d2226c2c30ce" },
          "integration": { "state": "pending", "commit": null, "stable_patch_id": null }
        },
        {
          "subject": "feat(desktop): main-process diagnostics capture controller (U3a)",
          "role": "implementation",
          "disposition": "required",
          "related_to": "4ff79eaa89dc1eba0565b937a9c3b707db7bc094",
          "source": { "commit": "6791a4816be1e10aaf58b583b0403b6f4333d38b", "stable_patch_id": "7d1058747ec25f42f784d7cad44e00baee2e62ff" },
          "integration": { "state": "pending", "commit": null, "stable_patch_id": null }
        },
        {
          "subject": "feat(gateway): armed diagnostics ring with sub-5s stall capture (U3b)",
          "role": "implementation",
          "disposition": "required",
          "related_to": "4ff79eaa89dc1eba0565b937a9c3b707db7bc094",
          "source": { "commit": "d48f09f7b80688f5ec004e67d7aca5e2d50c0f15", "stable_patch_id": "c271c1fa18d7ff37b6c03c19a903ee688e3237da" },
          "integration": { "state": "pending", "commit": null, "stable_patch_id": null }
        },
        {
          "subject": "feat(desktop): capture UX, sanitized bundle export, hermes debug diagnose (U4)",
          "role": "implementation",
          "disposition": "required",
          "related_to": "4ff79eaa89dc1eba0565b937a9c3b707db7bc094",
          "source": { "commit": "f5ecefb7d7c65023f34119209f078e063cc30a81", "stable_patch_id": "c612111f63bc0c0eb6e003a56f2bfae4f574daf9" },
          "integration": { "state": "pending", "commit": null, "stable_patch_id": null }
        },
        {
          "subject": "test(perf): hitch-classify proof scenario for diagnostics capture (U5)",
          "role": "test",
          "disposition": "required",
          "related_to": "4ff79eaa89dc1eba0565b937a9c3b707db7bc094",
          "source": { "commit": "471a3312f4412fc7d46dde78afba93e8d649bf0d", "stable_patch_id": "11a4f4cd7f621e1217f17672cb90cc482d9fb6ca" },
          "integration": { "state": "pending", "commit": null, "stable_patch_id": null }
        },
        {
          "subject": "docs: record closeout status and U6/U7 parking evidence in hitching plan",
          "role": "documentation",
          "disposition": "required",
          "related_to": "4ff79eaa89dc1eba0565b937a9c3b707db7bc094",
          "source": { "commit": "543f47a6b3d989b1427546ed0a96945749293727", "stable_patch_id": "94032a920e6ede8dabe2d9b6646d5802fa73c932" },
          "integration": { "state": "pending", "commit": null, "stable_patch_id": null }
        }
      ]
    },
    {
      "id": "gateway-config-offloop",
      "category": "gateway",
      "upstream_status": "review_required",
      "intended_upstream_status": "required",
      "source": { "repository": "fork", "ref": null, "legacy_ref": "fork/feat/gateway-config-offloop" },